{
  "version": "1.0.0",
  "problemTypes": {
    "FOUNDATION": {
      "description": "Infrastructure, scaffolding, and configuration tasks",
      "subtypes": {
        "infrastructure": {
          "description": "Core infrastructure setup (build systems, CI/CD, tooling)",
          "keywords": ["infrastructure", "setup", "foundation", "bootstrap", "init", "scaffold"],
          "riskLevel": "low",
          "techniques": {
            "planning": "ps-plus",
            "implementation": ["least-to-most"],
            "verification": "self-refine"
          }
        },
        "scaffolding": {
          "description": "Project structure and boilerplate generation",
          "keywords": ["scaffolding", "boilerplate", "template", "structure", "skeleton"],
          "riskLevel": "low",
          "techniques": {
            "planning": "ps-plus",
            "implementation": ["chain-of-code"],
            "verification": "self-refine"
          }
        },
        "configuration": {
          "description": "Config files, settings, environment setup",
          "keywords": ["config", "configuration", "settings", "environment", "env", "plist", "json config"],
          "riskLevel": "low",
          "techniques": {
            "planning": "react",
            "implementation": ["self-refine"],
            "verification": "tdd"
          }
        }
      }
    },
    "DATA": {
      "description": "Data modeling, access, and state management tasks",
      "subtypes": {
        "data-modeling": {
          "description": "Core Data models, entity relationships, schemas",
          "keywords": ["model", "entity", "schema", "core data", "coredata", "relationship", "data model"],
          "riskLevel": "medium",
          "techniques": {
            "planning": "tot",
            "implementation": ["least-to-most"],
            "verification": "self-consistency"
          }
        },
        "data-access": {
          "description": "Repository pattern, CRUD operations, queries",
          "keywords": ["repository", "crud", "fetch", "query", "database", "persistence", "save", "delete"],
          "riskLevel": "medium",
          "techniques": {
            "planning": "ps-plus",
            "implementation": ["tdd"],
            "verification": "reflexion"
          }
        },
        "migration": {
          "description": "Data migrations, schema updates, data transformations",
          "keywords": ["migration", "migrate", "upgrade", "schema change", "data transform", "version"],
          "riskLevel": "high",
          "techniques": {
            "planning": "least-to-most",
            "implementation": ["chain-of-code"],
            "verification": "reflexion"
          },
          "notes": "High risk due to potential data loss"
        },
        "state-mgmt": {
          "description": "State management, observable patterns, data flow",
          "keywords": ["state", "observable", "@Observable", "binding", "published", "store", "redux"],
          "riskLevel": "medium",
          "techniques": {
            "planning": "tot",
            "implementation": ["tdd"],
            "verification": "reflexion"
          }
        }
      }
    },
    "ARCHITECTURE": {
      "description": "System design, protocols, and service implementation",
      "subtypes": {
        "system-design": {
          "description": "High-level architecture, component design, system structure",
          "keywords": ["architecture", "system design", "design", "structure", "module", "component design"],
          "riskLevel": "high",
          "techniques": {
            "planning": "tot",
            "implementation": ["self-consistency"],
            "verification": "got"
          }
        },
        "protocol-design": {
          "description": "Protocol definitions, interfaces, contracts",
          "keywords": ["protocol", "interface", "contract", "api design", "abstraction"],
          "riskLevel": "medium",
          "techniques": {
            "planning": "got",
            "implementation": ["self-refine"],
            "verification": "self-consistency"
          }
        },
        "di-setup": {
          "description": "Dependency injection container and setup",
          "keywords": ["dependency injection", "di", "container", "inject", "resolve", "factory"],
          "riskLevel": "medium",
          "techniques": {
            "planning": "ps-plus",
            "implementation": ["least-to-most"],
            "verification": "tdd"
          }
        },
        "service-impl": {
          "description": "Service layer implementation, business logic services",
          "keywords": ["service", "business logic", "use case", "interactor", "manager"],
          "riskLevel": "medium",
          "techniques": {
            "planning": "ps-plus",
            "implementation": ["tdd", "self-refine"],
            "verification": "reflexion"
          }
        },
        "refactor": {
          "description": "Code refactoring, restructuring, cleanup",
          "keywords": ["refactor", "restructure", "cleanup", "reorganize", "extract", "rename"],
          "riskLevel": "medium",
          "techniques": {
            "planning": "ps-plus",
            "implementation": ["self-refine"],
            "verification": "tdd"
          }
        }
      }
    },
    "UI_UX": {
      "description": "User interface and experience implementation",
      "subtypes": {
        "ui": {
          "description": "General UI implementation, views, screens",
          "keywords": ["ui", "view", "screen", "interface", "layout", "swiftui", "uikit"],
          "riskLevel": "low",
          "techniques": {
            "planning": "ps-plus",
            "implementation": ["self-refine"],
            "verification": "self-refine"
          }
        },
        "component-lib": {
          "description": "Reusable component library, design system components",
          "keywords": ["component", "reusable", "library", "design system", "atomic"],
          "riskLevel": "medium",
          "techniques": {
            "planning": "tot",
            "implementation": ["self-refine"],
            "verification": "self-refine"
          }
        },
        "design-tokens": {
          "description": "Colors, typography, spacing, theme tokens",
          "keywords": ["color", "typography", "font", "spacing", "theme", "token", "style"],
          "riskLevel": "low",
          "techniques": {
            "planning": "ps-plus",
            "implementation": ["self-refine"],
            "verification": "self-refine"
          }
        },
        "animation": {
          "description": "Animations, transitions, motion design",
          "keywords": ["animation", "animate", "transition", "motion", "spring", "withAnimation"],
          "riskLevel": "medium",
          "techniques": {
            "planning": "got",
            "implementation": ["self-refine"],
            "verification": "self-refine"
          }
        },
        "gesture": {
          "description": "Gesture handlers, touch interactions, swipe actions",
          "keywords": ["gesture", "swipe", "tap", "drag", "pan", "touch", "interaction"],
          "riskLevel": "medium",
          "techniques": {
            "planning": "tot",
            "implementation": ["chain-of-code"],
            "verification": "self-refine"
          }
        },
        "accessibility": {
          "description": "Accessibility features, VoiceOver, dynamic type",
          "keywords": ["accessibility", "a11y", "voiceover", "dynamic type", "accessible"],
          "riskLevel": "medium",
          "techniques": {
            "planning": "ps-plus",
            "implementation": ["tdd"],
            "verification": "reflexion"
          }
        },
        "polish": {
          "description": "UI polish, refinements, visual improvements",
          "keywords": ["polish", "refine", "improve", "tweak", "adjust", "visual"],
          "riskLevel": "low",
          "techniques": {
            "planning": "react",
            "implementation": ["self-refine"],
            "verification": "self-refine"
          }
        }
      }
    },
    "TESTING": {
      "description": "Test implementation and testing infrastructure",
      "subtypes": {
        "test-setup": {
          "description": "Test infrastructure, mocks, fixtures, helpers",
          "keywords": ["test setup", "mock", "fixture", "test helper", "test infrastructure"],
          "riskLevel": "low",
          "techniques": {
            "planning": "ps-plus",
            "implementation": ["chain-of-code"],
            "verification": "self-refine"
          }
        },
        "unit-test": {
          "description": "Unit tests for individual functions/classes",
          "keywords": ["unit test", "test case", "test function", "assert", "expect"],
          "riskLevel": "low",
          "techniques": {
            "planning": "ps-plus",
            "implementation": ["tdd"],
            "verification": "self-refine"
          }
        },
        "integration-test": {
          "description": "Integration tests across components",
          "keywords": ["integration test", "integration", "end to end", "workflow test"],
          "riskLevel": "medium",
          "techniques": {
            "planning": "least-to-most",
            "implementation": ["tdd"],
            "verification": "reflexion"
          }
        },
        "snapshot-test": {
          "description": "UI snapshot tests for visual regression",
          "keywords": ["snapshot", "screenshot", "visual test", "ui test"],
          "riskLevel": "low",
          "techniques": {
            "planning": "ps-plus",
            "implementation": ["self-refine"],
            "verification": "self-refine"
          }
        },
        "e2e-test": {
          "description": "End-to-end tests with full app simulation",